Period Ending,3/31/2016,3/31/2015,3/31/2014,3/31/2013
Net Income,501000,246000,128000,134000
Operating Activities Cash Flows Provided By or Used In
Depreciation,-,-,-,-
Adjustments To Net Income,-,-,-,-
Changes In Accounts Receivables,-8000,-8000,-8000,11000
Changes In Liabilities,-,-,-,-
Changes In Inventories,-,-,-,-
Changes In Other Operating Activities,-,-,-,-
Total Cash Flow From Operating Activities,484000,239000,214000,123000
Investing Activities Cash Flows Provided By or Used In
Capital Expenditures,-,-,-,-
Investments,-,-,-,-
Other Cash flows from Investing Activities,-,-,-,-
Total Cash Flows From Investing Activities,-179000,-224000,-246000,-159000
Financing Activities Cash Flows Provided By or Used In
Dividends Paid,-,-,-,-
Sale Purchase of Stock,-,-,-,-
Net Borrowings,-,-,-,-
Other Cash Flows from Financing Activities,-179000,-224000,-246000,-159000
Total Cash Flows From Financing Activities,-,-,-,-
Effect Of Exchange Rate Changes,-,-,-,-
Change In Cash and Cash Equivalents,305000,15000,-33000,-36000